ID,text,src,label
146743,"У моего  котика Филиппа воспалилась десна ,откалолся зуб, врачам клиники огромное спасибо,!за спасение от смерти моего любимца, отличная клиника, весь персонал вежливый и отзывчивый! Всех благодарю,!!!
",geo,1
17877,"не получила, деньги вернули.",rureviews,0
140906,"Это заведение вообще отдельная история, если ты туда попал, то помощи можно не дождаться. Все кругом хамят, грубят, скоро и материть начнут. Желания туда ходить нету, но выбор не велик.
",geo,0
205278,"В значении этой фразы вы будете убеждаться на протяжении всего фильма.

Это первая самостоятельная работа Адриана Грюнберга, этот фильм однозначно стоит посмотреть, только хотя бы из-за того, что здесь Мэл гибсон.

Динамичность картины с самого начала захватывает дух, здесь нет ничего лишнего..ни затянутых моментов, ни неловких пауз, ни невписывющихся актеров. Все стоит на своем месте. 

Что касаемо музыки, она тут подобрана отлично. Она хорошо передает атмосферу, в каких-то моментах драматизм, в каких-то напряжение, за неё кстати отдельный '+'.

'Стрельба, наркотики, секс, пушки, грязь, кровь, продажные копы. Мексика'  

В этом фильме есть все атрибуты хорошего боевика.

В самом же 'безымянном герое' возможно вы увидите знакомого нам персонажа по 70% боевиков с Мэлом Гибсоном. В нем совмещается квинтэссенция таких качеств, как доброта, чувственность, хитрость, пронырливость и множество других. 

Если вы хотите посмеяться, повосторгаться от динамичных сцен и наконец увидеть старого-доброго Мэла Гибсона, однозначно, сходите на этот фильм.

Подводя итог, я могу сказать, если вы поклонник творчества Мэла Гибсона, то вам он обязателен к просмотру. Среднестатистический же зритель обойдет его стороной, а если и не обойдет то он просто напросто пополнит свою шкатулку забвенных фильмов.

7 из 10",kinopoisk,0
9654,"ношу российский 40-42.заказала с,но и он мне оказался большим (плечи большие.рукава тоже.муж сказал как халат на мне.",rureviews,0
112806,"Достаточно сомнительный клип на песню из эндинга ко второму сезону Девушки на час.Клянусь, соответствующая оценка стоит не из-за предвзятости, не из-за крайне отрицательного отношения к самой Девушке на час. Просто сам клип действительно отстойный, на мой взгляд. Сама песня, конечно, очень приятная, но она и так играла в эндинге Девушки на час, поэтому зацикливаться на ней я особо смысла не вижу, и куда логичней обратить внимание на визуальный ряд. В целом, не сказать, что он выглядит некрасиво, но и ничего выдающегося в нём нет. Тем не менее, я могу назвать его явной халтурой. Одни и те же кадры повторяются несколько раз, а отдельные сцены и вовсе, как мне показалось, были показаны раз 10 (Серьёзно, просто посчитайте, сколько раз за весь клип был показан один и тот же кадр с девушкой, направленной вниз головой). К песне визуал, как мне кажется, совсем не подходит, и в совокупности этих факторов клип выглядит не только не впечатляюще, но и откровенно скучно и непривлекательно.",anime,2
123232,"Скучный сериал,персонажи ""серые"",иногда только Фредерика доставляла и понравился стиль боя ГГ,более менее похожий видел только у Hei,а в остальном вообще ничего интересного.Обычно,когда есть много девушек,то за кого-то ""болею"" в плане пары ГГ,но тут было вообще плевать кого он выберет.Не сказал бы,что аниме плохое,в общем моя оценка 5/10.P.S. хоть Чайка и не айс,но в много раз лучше,чем убогий Captain Earth от  тех же Bones.",anime,2
128428,"+: большая территория, много разных развлечений: и лабиринт, и песочница, и бассейн с шариками, и игровые автоматы,и стол с лего. Наконец-то добавили шарики в сухой бассейн, а то там уже год точно не бассейн, а даже лужой нельзя было назвать. \n-: в песочнице все самосвалы сломаны, причём уже год они там все валяются и не меняются на новые. 3 лопатки всего, а детей там всегда уйма.\nНекоторые автоматы не работают, а в те, в коротые мы играли, не выдают билеты (хотя на них не было написано).\nИ некоторые элементы в том же лабиринте отсутствуют (треугольники, чтобы залезть по склонной поверхности на 2 этаж), качалки обшарпаны. Маты не закреплены, которые лежат внизу при спуске с большой горки. На НГ представление так натерли полиролью горку, что дети летели вниз с горки с большой скоростью и эти маты улетали далеко. Я после каждого ребёнка поправляла, чтобы мой не приземлился носом не в мат, а в половое покрытие (а за многими детьми родители не следят). Поэтому, считаю, что надо в этом месте маты закрепить или сделать один большой, может, не так будет ездить, когда дети спускаются с горки.\nИ ещё по поводу НГ представления. Уж если есть у вас расписание, то хоть придерживайтесь немного программы. Пришли на тигру, он вышел через полчаса от положенного времени. А на мастер класс по изготовлению открытки так и не попали. Ушли через 40 минут после предполагаемого начала, так и не дождавшись его.
",geo,0
67697,gor no goods. cdek sent it back without calling me. or stole it.,rureviews,2
121384,"Еще одно аниме пало жертвой того, что в нем чего-то не хватает, в данном случае это сюжет. Он на самом деле как бы и есть, но на экране этот сюжет будет максимум ~6 серий. Вообще аниме неплохое, есть в нем что-то интересное, но вот зайдет оно точно не всем.Первое что привлекло это опенинг(случайно наткнулся) и концовка(так же случайно). Все это действо походило на какой-то дикий фарс. И тут я понял - это нужно увидеть! спойлер www.youtube.com www.youtube.comВторое - тут есть атмосферное муз сопровождение и какое-то прикрытое ""БДСМ"" спойлер www.youtube.com (тот зверь - это ГГ)  вообще дизайн вот этих персонажей неплохо так зашел.И третье - целевая аудитория странная, поэтому не удивительно, что для большинства анимешка проходняк. Это и сеЙнен и банальнейший сенен(почти примитив), капля седзе, и недо-махо с перевоплощениями(типо волшебницы. Тут часть битв на перевоплощениях и с одного скилла сливают, все это похоже на ""Сейлор мун""). От Сейнена тут есть несколько хороших серий(даже со смыслом) и вот они смотрелись с интересом. Банальный сенен в сюжете и во всех этих их стандартах(включая ГГ). Капля седзе тут разбавляет весь этот треш(плюсом и общая направленность, как например в ""Магазинчике ужасов"").Поставил бы баллов шесть, будь тут общий вменяемый сюжет, но без него увы очень тяжело смотреть такое, поэтому только 4/10",anime,2
207902,"Начало не впечатляло, но делать было нечего. Собственно все сводится к сексу, управляющему женщинами. Самоуверенный Жорж, дорвавшийся до денег. 

Патиссон несколько однообразен, что не может расстраивать. Всегда думала, что к женщинам нужен индивидуальный подход, а тут все по одной схеме за пару минут. Ну вот уже и все в постели. 

Кстати, постельных сцен многовато. Ну на мой взгляд.

Женские образы достаточно неплохи. Но порадовала больше всего Клотильда. Пожалуй, она единственная, кто вытянул свою роль. По крайней мере ее героиня казалась самой искренней. 

Порадовали еще и последние минут 40. Наконец-то все стало малость сложней постели. И не было предела умилению, когда до зарвавшегося мальчика дошло, что им играли и управляли как только хотелось. В погоне за любыми деньгами он прекрасно упустил главную выгоду. Я бы сказала дважды. 

Желая жить роскошно, а не гнить в нищете, Жорж благополучно уничтожил собственную душу. Не Вирджинию, Клотильду, Мадлен и Сюзанну унизил, использовал и морально убил, а себя самого. Так и не заметив этого. 

Возможно, что фильм не идет ни в какое сравнение с книгой, но я не читала. Для отдельно взятого сюжета не столь уж и плачевно. Есть все-таки что-то идейное. Хоть и слабоватое.",kinopoisk,0
139836,"Обычный строительный магазин.  Ассортимент довольно скудный,  но вполне на уровне остальных магазинов города. Цены сравнительно низкие. \nПродавцы при обращении к ним помогают, но не сказать, что прямо уж очень предупредительны - просто делают свою работу на приемлемо уровне.
",geo,0
188120,"Покупая билет на самолёт Победа,помните,что на каждом шагу вас подстерегает алчность и непорядочность. Если вы регистрируетесь в аэропорту и летите компанией,и даже если с детьми,вас обязательно посадят на разные места,и месть рядом можно только за дополнительные деньги. Если регистрируетесь самостоятельно через сайт,то доплачивать за выбор любого места тоже придётся. Но если вы летите компанией,то вряд ли сможете взять места рядом,сайт работает криво,и вам все равно дадут места разные. Позвонить в компанию можно только за СВОИ деньги,и это 85 рублей… и далее снова все только за дополнительные деньги. В общем лететь «Победой», только в крайнем случае!!! Если нет другого выбора и вы не с детьми. 
",geo,2
104678,"Довольно неплохое аниме. Мне очень даже понравилось и добавлю в свои любимые, также рекомендую к просмотру) Надеюсь, что вскоре герои смогут заполучить свое счастье и перестанут быть буквально как на войне о чем и говорит само название) Два гения борятся за право на победу в этой ""войне"" пытаясь заполучить заветные слова ""Я тебя люблю"" и на это интересно смотреть. Из второстепенных персонажей понравилась Хаясака. Она просто поразила меня своей очаровательностью и взглядом, которые отражает душу человека, также нельзя не отметить сестру Сироганэ, по-моему, ее зовут Кэй. Ну да ладно, впрочем, вы уже поняли о ком я) Присутствует множество забавных момент и это при том, что тут всего 12 серий! Просто можно вырезать на мемы и постить где-нибудь на просторах интернета. В данном тайтле также не банальные, как мы привыкли видеть в других аниме герои, а довольно разнообразны и красивы не только внешне, но и свомм интеллектом. В заключение хочу огласить свою оценку и ей будет не очень объективная 10-ка. Уж простите, но у меня свои критерии по оцениванию)",anime,1
184204,"В данное заведение заезжала с 2020 года, всегда брала денер с говядиной или хот-дог. С конца 2022 года почувствовала разницу в худшую сторону. Сегодня заказала денер с говядиной, была удивлена что соуса добавили через край, дошла до мяса, моему удивлению не было придела, столько кусочков положили, как ни когда. Обычно было до 5 кусков, сегодня было 11. Но самое главное, мясо было тухлое!!!! Вы что творите??? Мясо фонит, так еще и цвет желтый. Теперь ясно почему столько «бонусов» добавили в булку. Обнаружила все это по дороге, вернуться не было возможности! К сожалению съела пару кусков и не дай Бог мне станет плохо, Вас посетит Роспотребнадзор. К Вам больше не вернусь!!!
",geo,2
90859,"Наконец-то я досмотрел.Ну, в общем очень даже неплохо, если не обращать внимание на постоянные ревы гг и сочувствие к врагам. Когда в аниме спасают врагов, то для меня оно автоматически становится хуже говна. Но тут, конечно, можно обратить внимание на то, что они практически друзья и давно друг друга знают.6/10спойлер.Я так понял, что Харуто жив по манге, ибо в вике его статус — «Alive». Это хорошо, иначе мне разбили бы сердце.",anime,0
245210,Безопасная,perekrestok,2
272714,"Достоинства:
доступность, мягкое очищение, приятные ощущения при использовании.

хороший гель для умывания. в начале использования пару раз пощипывало кожу, позже такого не повторялось. со своей задачей справляется, после умывания необходим крем (кожа подсушивается, но это вполне нормально и с моей стороны ожидаемо)",perekrestok,1
173025,"Площадка ужасная, везде мусор, тропинки вокруг по колено в грязи, в озере гниёт туша лося, даже подойти к воде невозможно, запах невыносимый
",geo,2
166050,"Вкусно! Много столиков, но к некоторым трудно дойти с подносом из-за обилия лестниц! Большой выбор блюд на любой вкус!
",geo,1
178320,"Мне не понравилось. Знал бы что тут такие очереди, поехал бы лучше на окраину города! Больше бы времени с экономил. Я вообще не хожу по бесплатным поликлиникам , потому что меня убивают эти очереди, а тут им ещё деньги платят, и сидишь по пол дня! Если бы делал за свой счёт, то развернулся бы в одну минуту! Ну и остальным , кто бережет свое время, лучше найти другую организацию! \nПрошу этой компании не отвечать шаблонными стандартными фразами, делая вид что что-то решается, хотя на самом деле это имитация бурной деятельности, и создание ложного образа компании, чтоб люди думали что что-то решается \nС двух единиц поменял на одну. Сижу у 15 кабинета пол часа, в самой клинике уже часа 2, 
",geo,2
195972,"как я могла забыыыть))
ЛЮБВИ НЕ ПОЖЕЛАЛА,ЁКАРНЫЙБАБАЙ)
только ,знаешь,что?
не какой-нибудь там..а самой чистой,искренней и самой настоящей!1

и фотку такую забабаахаем :D
ну ты меня понимаешь)",rusentiment,1
36997,"мой самый любимый продавец!!) обожаю его!)) заказываю уже четвертый раз у него два комплекта, юбку и платье, всегда помогает с размером, на параметры 85_64_91 рост 171 вес 55 советует размер С) платье отлично подчеркивает фигуру, правда беда всех бандажей сдавливает грудь и попу. Отправил на следующий день) пришло за 9 дней в Москву. Качество отличное!) и согласитесь что сейчас футболка в Страдивари или бершке стоит 1-1.5т, а тут платье вышло мне на распродаже 1250!",rureviews,1
191046,"23 декабря оформляла кредитную и дебетовую карту Альфа-банк г. Самара, ул. Победы 101.При получении этих карт консультант(к сожалению не помню её имени) сказала что при быстрой активации нужно снять определённую сумму и обратно положить. Ничего за это не спишется. Мы прошли к банкомату, я снялас КК 1000 рублей, затем сразу же перевела на дебетовую. После она сказала, что можно обратно с дебетовой перевести на кредитную в мобильном приложении. Я так и сделала. Каково мое было удивление, через несколько дней, что с меня списывают процент. В чате сказали, что это за снятие денег. Это что такое было, что за обман, я так поняла сейчас, ради премии... Мне кредитная карта нужна для покупок и оплаты услуг, а не для снятия наличных. Я не могу сейчас даже оплатить коммунальные платежи без процентов. Я их для пробы оплатила, показывает что как перевод и в льготный период не входит",bank,0
136809,"Овощи, фрукты-гнилье, ценники зачастую не соответствуют при пробивании на кассе
",geo,0
28706,"Качество ужасноея, брала хл- на мой 48/50 большевато. Синтетика(((",rureviews,0
24500,"The size is incorrect. The XL is not for XL, it is for S-M",rureviews,0
38464,"Хорошая юбка, соответствует описанию, в точности как на представленной модели, приятная на ощупь, хорошо тянется, красиво облегает фигуру, советую...тем более за такие деньги. Доставка быстрая, до Воронежа долетела за 13 дней. Продавцу спасибо за подарок, резинку для волос.",rureviews,1
