ID,text,src,label
26739,smaller than in description.,rureviews,0
198426,Слева от меня Алексей Ильмухин. Путешественник и интересный человек. В числе его личных побед - путешествие на велосипеде от Челябинска до Байкала... Приехал к нам помочь в организации семинара Мухтара. Просто взял и приехал из Челябинска и начал помогать... ))👍 #можеткаждый,rusentiment,1
172615,"Ребёнок в садик отходил год, из них пол года просто на больничном. На вопрос почему детей не осматривает утром медсестра, ответ дали простой -она ж не врач!!! Зачем тогда она нужна в садике? Только пробы с пищи снимать? В группе грязно, игрушки не мылись ни разу! Если что-то надо -все родители! Элементарно, окна мыть должны тоже родители! Крик души! Накипело! Заведующая бездействует! Не раз приходили на разговор! Изменений не видим!!!
",geo,2
246532,Замерзла на -15,perekrestok,2
209852,"Как всегда, название не соответствует истинному переводу Duplicity - двуличность!

Это было первое что меня напрягло. Как то так стечением обстоятельств не смогла посмотреть фильм в кинотеатре, и в принципе много не потеряла. 

Киношка заранее интригует с первых минут фильма, но чем дальше в лес как говорится, тем жирнее партизане, и тем темнее кущи лесистые. Все заморочено на нет. Это же надо было высмеять, выставить в самом неподобающем свете американскую контрразведку. 

Фильм уже к середине начинает нереально напрягать своей занудливостью и заморочкой. Очень много слямзенных моментов. Вырвано кусками там и там, от начала до концовки. Если собрать фильм в кучу, как пазлы, то все понятно, но замудренность на то и есть чтобы заинтересовать зрителя. 

Клайв Оуэн вообще на высоте, умеет он играть шпионов, хороших дядей, потрясных влюбленных, и горячих любовников. Это его стихия.

Дж. Робертс разочаровала. Не являюсь фанаткой этой актрисы, и считаю ее очень зазвездившейся. Она уже стала немного сгибаться под тяжестью короны. И игра ее совсем не впечатлила. Но они очень хорошо вместе смотрятся.

Оценка 4 из 10 и то за Оуэна и за замысловатый сюжет!",kinopoisk,0
27996,"Очень долго,ну прям очень, две недели только обрабатывали заказ, больше месяца шла посылка. Юбка по себе хорошая, был запах, пропал. С размером угадала М.",rureviews,0
39836,"Очень понравились штинишки))) качество супер! рекомендую, не пожалеете! на рост 160 см об 92 взяла М подошли идеально))) с продавцом не общалась, не было нужды)))) но спасибо ему за маленький подарочек)))",rureviews,1
48753,"Футболка классная,качество отличное",rureviews,1
273666,"Достоинства:
Приятный для кожи,приятно пахнуший.

Недостатки:
Нету телок!

Классный запах.",perekrestok,1
46430,"Покупкой довольна! На рост 175см, ОГ 105см села хорошо. Длину водолазки хотелось бы чуть длиннее, а так все устраивает. Спасибо продавцу! УДАЧИ!",rureviews,1
133872,"Очередь большая, хотя всё по записи. А так всё хорошо, персонал приветливый, МРТ делают хорошо, но как я уже сказала - единственный минус это очередь
",geo,0
184019,"Давно нахожусь в поиске хорошей студии для маникюра и в этот раз выбор пал на Кисточки. \nЗаписал меня менеджер на маникюр 18 июня, но когда я пришла в салон после 20 минут ожидания мастера мне сказали, что мастер не сможет сделать маникюр, так как он не успевает, а у него ещё педикюр. \nНе понятно, как записывают менеджеры клиентов, если мастер не успевает.
",geo,2
146049,"Раньше был рынок как рынок, а сейчас совсем не то, мясо купить, это только накачаное водой  , если рыба то в основном если не просроченная то каша а не рыба, администрация смотрит на это сквозь пальцев, аренду платят и хорошо, а так хотелось бы чтоб наш рынок был как раньше, более душевней, для покупателя, а не как сейчас, превратили его в торговый центр, где души нет
",geo,0
283744,"Эффект замечательный, помогает даже в зимнее время!",perekrestok,1
172291,"Были в юнити петроградка 07.04, испортили вечер!!! Были с друзьями, один из гостей пришел в спортивном стиле одежды, охрана встала стеной на входе, как будто мы на них в бой идем,  и в итоге друзей не пустили в ресторан из-за дресс-кода. И все бы ничего если бы о нем знали заранее, но ни при брони стола,хотя звонили несколько раз заранее и все уточняли, ни в переписке с администратором, ни на сайте информации о дресс коде нет и ни кто ничего не сказал!  Сразу со входа пошел негатив, настроение испорчено! Ладно, часть компании уехала так и не побывав у вас,далее пока сидели непонятно что случилось, но возле нашего стола разбили какой-то соус, в итоге вся спина на светлой рубашке мужа в жирных пятнах + мое платье в пятнах, очень хочется верить что они отстираются, при этом даже ни кто не извинился за это + около нашего стола долго были разбитые осколки в луже и их не торопились убирать. Далее за все это хотели взять сервисный сбор от счета, хотя при брони нам точно сказали, что 6 чел без сервисного сбора! Вообщем вечер испортили, рекоммендовать данное заведение не буду, сами скорее всего не вернемся! Меняйте свою политику общения с клиентами, особенно администратор + лучше обучайте персонал, чтобы они своевренно уведомляли о всех правилах заведения! 
",geo,2
2987,"Мне маленькие, я ростом 170см",rureviews,0
93000,"Коротко о сезоне: Непрекращающийся Эпик Флекс всех над всеми. Боец Боки всегда был безумен, но в этом сезоне это безумие прям прёт из всех щелей. И это определённо тот случай, когда адаптация от Нетфликса - это вин. Оторванные лица, летающие зубы, древнее искусство ударов по шарам, открытые переломы - бессмысленное, но чёрт возьми весёлое старое доброе ультранасилие.Если в первых сезонах хоть иногда, но проскальзывала интрига в боях, то здесь окончательно сделали упор не в то, кто победит, а в то, насколько мощным будет флекс победителя над проигравшим.Из новых персонажей зашёл Дзяку, очень харизматичный полудед и Легендарный дед Каку Кайо, который вертел смерть на своём 150-летнем приборе. Баки продолжил свой путь к ГАРности, ну а как иначе, ведь мы знаем самый эффективный способ стать самым сильным человеком на Земле (секс). Али-младший - это дикий рофл от мангаки, очевидная отсылка к этому мему из Жижи612x344Ну серьёзно, так хайпить персонажа, чтоб превратить его в мешок для избиений.В общем, Боец Боки - оняма явно не для всех и явно не шедевр, но со своей ролью качественного трешака с насилием и флексом справляется на ураП.С. Возвращение спойлерсмертников - это сюр на совершенно другом уровне. Спящий на стене Сикорский, Инвалид Дио, Человек-конфета с вечным днём ног, ну и конечно, абсолютно легендарный Спек-овощ с его тренировкой в виде мысленного плавания в сперме баттерфляем. Вы вдумайтесь, насколько это тупо: Мысленное плавание в сперме баттерфляем",anime,0
92363,"типичный гаремник что ещё тут может быть. Ну показали всех бабёх извращенками ""типо"" по мне так обычные бабы ничего извращенского. В общем в аниме высасали тему из ничего, комедия ситуаций копипаст из всех других гаремников всё по накатанной.",anime,0
229741,"Людей выводят и винтят. 5:50 Пишут, что Беркут начал распылять слезоточивый газ. В такой давке это конечно пиздец, надышишся, упадешь и тут то тебя и затопчут. Сейчас там очень страшно. 5:39 Столкновение митингующих и Беркута, вид с моста сверху. Черное справа Беркут, оранжевые каски слева митингующие. 5:31 Поток Беркута джифкой 5:29 Да, точно прорвали, Беркут прорывается со стороны Институтской улицы 5:26 Судя по всему, баррикаду все-таки прорвали 5:13 Пока Беркут пиздит людей, коммунальщики разбирают баррикаду. 5:07 Баррикаду пытаются распилить бензорезом, активисты в ответ закидывают Беркут дымовухами, а те швыряют их обратно.",linis,2
31306,"Платье красивое, как на картинке.",rureviews,1
71024,"Товар немного не соответствует описанию, ткань не такая плотная как на фотографиях, рукава не фонариком а обычного пошива, это расстроило",rureviews,2
269370,"Покупала разную пастилу этого производителя без сахара (классическую, с клюквой), вся нравилась, но почему-то именно у этого вкуса текстура разочаровала: вязкая, нарезать невозможно сминается, тянется за ножом и липнет. Может быть партия не удачная попалась, но проверять это желания нет",perekrestok,0
173328,"Склад работает ужасно. Чтобы загрузится нужно простоять 6-8 часов и то не всегда   успевают загрузить. Потому что бардак в отгрузке. Если грузятся в нескольких скаладах , то на одном загрузили и опять стоишь в очереди ,чтобы загрузиться в другом. Все кто позже Вас приехал оказываются в переди. Работайте лучше с ГК Демидов. Там дешевле металлопрокат и с погрузкой быстрей.
",geo,2
65793,"Заказ я не получил совсем, так ещё и возврат денег не сделали. Не стоит покупать у данного продавца.",rureviews,2
11235,"Платье сшито хорошо, но по размеру не подошло, по длине тоже..нужно было брать скорее всего L..выше колен сантиметров на 20..внизу тугая резинка..при примерке выглядело не так как на картинке",rureviews,0
125621,"Раньше было лусше, а теперь постоянно у них проблемы с программой!!! Сидишь и ждешь- когда они в комп загрузят информацию- лесить времени не остается!
",geo,0
276185,Когда выходит газ не очень вкусная!,perekrestok,1
161573,"Чудесная врач гинеколог , очень внимательная! Делала узи , очень понравилось! Большое спасибо !врач Тусманова С.И. 
",geo,1
213608,"Не особо люблю фильмы, снятые на основе комиксов, но «Тень» являются исключением из этого числа. Его можно смотреть всегда и в любом возрасте.  

Мне очень нравится сюжет этого фильма, а исполнитель главной роли Алек Болдуин играл просто бесподобно, его Ламонт - настоящий герой, ничем не хуже «Человека паука» и «Бэтмана».  Несмотря на то, что фильм не новый, он может понравится и заинтересовать многих. В фильме есть и спецэффекты, и погони, любовь и потрясающая музыка, особенно саундтрэк к фильму,  эта одна из моих любимых песен. А сцены с летающим кинжалом считают сняты превосходно, когда смотрела первый раз прям дух захватило. 

Фильм стоит того, чтобы посмотреть, а любителям фильмов, снятых по комиксам, заполучить в свою коллекцию.",kinopoisk,1
75421,"Заказ так и не пришёл, деньги так и не вернули, трек не отслеживался, открывала спор, но так как сама прошляпила сроки страховки деньги не вернули",rureviews,2
103909,"Чтож я ждал очень долго, когда наконец выйдет данный тайтл, и очень рад был тому, что он вышел. Он мне очень понравился, надеюсь на второй сезон ( т.к. ещё не доконца рассказали и объяснили причину того, почему главный герой не помнит часть прошлого). Опенинг и ендинг меня приятно удивили, они мне понравились. По началу мне казалось, что все девушки( цундеры) уж люто издеваются над ГГ. Как комедия мне очень, очень понравилось аниме, я каждую серию очень сильно смеялся, только пару раз ощущение было, что фансервиз( мне так порой казалось ). Все персонажи тут своеобразны по началу не все могут понравится, и даже временами раздражать, но потом они обязательно вам покажутся хорошими. Финал меня приятно удивил красочной схваткой, очень интересно было наблюдать за ней. Что я могу сказать, мне эта история очень понравилась да так, что надеюсь на второй сезон, она вам обязательно понравится.",anime,1
239559,"розой так сказать и не пахнет)) прозрачные гранулы не собрать, если просыпались на пол, так как практически незаметны. после пару походов животного «по делам» наполнитель теряет свой вид, местами становится жёлтым. в целом по сравнению с другими наполнителями - очень плох.",perekrestok,2
226237,"В поселке Ад-Диябия разгромлено укрытие бандформирования. Уничтожен наемник из Саудовской Аравии Бхит Ад-Дамер и террорист Махмуд Загмут. В городе Дарейя армейцы ликвидировали несколько террористов вместе с их оружием и боеприпасами. Среди уничтоженных некие Мухаммад по кличке Абу Аднан и Ахмад по кличке Абу Ан-Нур. В провинции Идлеб армейские подразделения установили полный контроль над районом Джебаль Аль-Арбаин. Там были разгромлены все скопления террористов из Джебхат Ан-Нусры и штабы их командования, уничтожено оружие минометные пушки, ракетные установки и боеприпасы. Как сообщил корреспонденту агентства САНА военный источник, в ходе операций были уничтожены десятки боевиков и разрушено много автомашин, оснащенных крупнокалиберными пулеметами.",linis,1
219875,"Наконец-то я добила эту дораму

Скажу честно сложно было

О Ха Ни - этот персонаж вызывал на протяжении фильма больше раздражения чем негативные персонажи в других дорамах, человек без чувства собственного достоинства, без самоуважения, это проявляется на протяжении всех 16 серий, она живёт в мире своих иллюзий, мечтаний, её унижают, но она продолжает нести роль верной болонки,  все её глупые проделки слежки не привели ни к чему  хорошему,

На протяжении всего сериала я ждала что в ней проснёшься хоть капля самоуважения, но у этой девчонки априори мозгов нет, все её существование посвящёно своему идолу,

Ближе к концу у меня появилась надежда, а вдруг, но увы, когда дело дошло до свадьбы, огромная доля презрения безразличия пофигизма я бы сказала от Бэе Сын Чжо, не охладила её пыл, хотя рядом были 2 замечательных парня, мне казалось что она была влюблена в свою любовь,  в общем отношение к ней главного героя сообразно её отношению к себе, я смотрела на перемотке, лучше ещё раз пересмотра дораму Я скучаю по тебе, чем это",kinopoisk,2
286452,Наполнитнитель хорошо комкуется и держит запах. Большой объем. Хорошее соотношение цена/качество. Кошкам нравится.,perekrestok,1
186754,"Магазин где 26 мая в14 .30. Охранница избила 80 летнюю бабушку!!!!!!кулаком по голове.!!!!Люди почему избивают наших стариков?!!!!!Бабушка хотела вернуть просроченный товар!!!!
",geo,2
48298,"хороший костюм, но очень трудно было определиться с размером",rureviews,1
151681,"Всем рекомендую посетить музей Фаберже. Не было одной экспозиции, но это не помешало получить огромное удовольствие от просмотра шедевров знаменитого ювелира. Пришли самостоятельно. Свободно оплатили билет с экскурсией, подождали 20 минут и плавно погрузились в бесподобную атмосферу красоты...... Всё на высшем уровне. Спасибо.
",geo,1
88896,"Как же люблю этот момент: 1366x7681366x768Чисто ради танца этого персонажа сзади готова пересматривать раз за разом. Просто один из лучших анимационных клипов. Очень уж люблю стиль Waboku (в большйе степени ее персонажей, цветовые решения, анимацию и интересные образы) и эту песню. 10 из 10.Второй клип мне нравится в меньшей степени, где-то на 8чку, потому что вот этот момент с пленкой и этот персонаж с дырой в форме сердца в голове цепляют. Так что общая у них 9.",anime,0
