ID,text,src,label
29262,"Плюсы:
+рекордно быстрая доставка с Китая-7 дней и еще 2дня пролежала на почте!(до Самарской области)
+ приятная ткань, но не такая, какую я ожидала
+длина юбки(рост 178)
+сшито аккуратно,ничего нигде не торчит
+продавец общительный
Минусы:
— на свой 44 размер(ношу М) заказала размер S,но юбка велика, и топ топорщится очень сильно.
Буду ушивать, но костюм рекомендую:)
Рекомендую девушкам с хорошими фигурами ибо платье все подчеркивает)

На фото не видно недостатков,так как просто удачно преподнесла платье)",rureviews,1
116452,"""...мы выбираем, нас выбирают...""Опять незамкнутый любовный треугольник, а точнее - ломаная линия. Единственное, за что похвалю аниме, - очень красивая старая рисовка, приятная для глаз. Присутствует обнажёнка (довольно эстетично поданная, на мой взгляд) и сексуальный контент, так что рейтинг 18+, пожалуй, оправдан.Сюжет. Довольно слабый: ощущение, что взят определённый временной отрезок, где происходит само действие. Не видно ни морали, ни посыла, ни особого развития. Ну да: любовные терзания и поиск своего места в этом мире, но...не впечатлило. Плюс даже не потрудились сделать внятную концовку, типа додумывайте сами...Героини. Две центральные девушки, в целом, адекватны, хотя, не всегда ведут себя логично. Спишем на чувства и эмоции, всё же не роботы. Поэтому их поведение можно понять и принять. Не согласиться с ним, но именно допустить возможность, ибо с дивана оценивать проще всего.""Главный герой"". Кавычки поставлены намеренно, поскольку настолько отвратного и раздражающего персонажа ещё поискать. Чтобы было понятней, скажу, что Юкитеру Амано (к примеру), по сравнению с ним - мужик и кремень. Его поведение - просто дно. Конечно, к концовке он меняется, но попытка показать его примером для других, в плане переосмысления своей жизни, - просто смешна.Если (вдруг) надумаете ознакомиться с сим творением - сразу же отключайте мозг. А так: не советую, поберегите свои нервы.",anime,2
62715,"доставка просто ужасная,товар шел через б
уду города ,больше месяца!! открылп спор , продавец его не обработал... больше. него заказывать не будк",rureviews,2
222613,"МАХА-ЙОГА Последователи этого пути используют все проявления существования, никоим образом к ним не привязываясь. Маха-йога переводится как великая йога-тантра, в смысле ее непревзойденности в применении упаи-метода, мужского аспекта. Ее целью является реализация абсолютной истины в аспекте нераздельности видимых форм и пустоты, когда все вещи принимаются как сущность ума и дхармакая, а также реализация относительной истины в аспекте чистой проявленной мандалы идамов. На относительном уровне все манифестации, мысли и проявления рассматриваются как сакральные аспекты божеств. Ученик воспринимает все существующее в качестве Божеств и концентрируется на недвойственности блаженства, ясности и не-мысли. Посредством употребления пяти мяс и пяти нектаров достигается недвойственное отношение к чистому и грязному, а в качестве плода практики достигается состояние мандалы пяти, ста тысячи или бесчетного числа тантрийских семейств-генезисов за одну человеческую жизнь, в момент смерти или в промежуточном состоянии.",linis,0
8192,"Пошито хорошо, модель красивая. Только ткань дешевая и не очень хорошего качества....",rureviews,0
95805,"8 из 10. Наверное главным образом потому что до этого аниме мне попался ""повар небесной гостиницы"", а там образ лиса прописан хуже как и образ ГГ)) Оба персонажа довольно приятные. Но смотреть 2й сезон меня откровенно не тянет.Сюжет не понравился. Сам статус богини который дали непонятно за что и который как выясняется из последующих серий не так сложно отобрать и ничего особенного не дает. Куча вопросов которые влом задавать, но они напрашиваются сюжетом, на которые ответа нет, и в целом не особенно цепляет. Например, откуда в ГГ драконий глаз? ###### это было вообще вводить по сюжету? она внучка лиса в которого влюблена? Или девушка которая съела глаз ушла от лиса и родила от кого-то другого и глаз передался по наследству? Каким каком глаз мог оказаться в теле ГГ? Далее, накой ушел бог и куда он девался сдав полномочия? Как можно сдать полномочия и остаться богом? Ит.д. В целом сюжет где школьница влюбляется в духа-хранителя храма это так себе идея, на мой взгляд))) Тот факт что все ее полномочия богини это влюбляться в хранителей и повелевать ими, и только в последней серии она удосужилась немножко улучшить атмосферу в храме очень как-то слабенько. Чтобы влюбляться в кого попало не нужно быть богиней.",anime,0
205393,"Обидно очень, что при такой правильной и душевной передаче атмосферы и событий советской эпохи режиссеру не хватило терпения или интуиции на кастинге: все испортило бездарное исполнение главных ролей подростками. Всем этим ребятам, кроме Гребенщиковой, в кино можно только ходить как зрителям, с билетами, купленными в кассе кинотеатров.

Не хочу увековечивать фамилии этих случайных в кинематографе людей, которые так испоганили хороший сценарий, потому что смотреть из-за них второй раз мало кому захочется.

Особенно отвратительны и фальшивы исполнители главных ролей, уникальную бездарность которых подчеркнула превосходная игра настоящих актеров (Усатовой, Кузнецова, Краско, Половцева). Они испортили все впечатление от фильма, который мог бы стать шедевром.",kinopoisk,0
140212,"Неплохой магазин, достаточно большой выбор товаров. Консультанты вежливые,но не все. Не так давно в магазине сделали перестановку. У меня было мало времени и необходимо было купить определенное средство. Я подошла к консультанту уточнить куда все перенесли, девушка достаточно в грубой форме ответила: «у нас теперь все на новых местах, ходите изучайте и запоминайте». Такое поведение консультанта достаточно неприятно и желание что-либо покупать сразу же отпадает.\nДля меня непонятно такое поведение сотрудников, с учетом того,что в 2 минутах ходьбы так же есть еще косметический магазин.
",geo,0
246547,Стали ещё тоньше и расходятся у отрыва,perekrestok,2
33270,"Посылка прибыла в Москву за 17 дней. Очень быстро. Все хорошо упаковано, кофта в полном порядке. Соответствует описанию. Понравилась. Спасибо.",rureviews,1
126974,"Кафешка замечательная, цены приемлемые, огромным минусом является платная парковка со сверхалчными парковщиками. Мы с женой ехали не на фуре, а на маленькой машинке, так этот сотрудник растолкал нас уставших в три часа ночи, и просто выклянчил эти несчастные сто рублей. Неуважительное отношение, и естественно никаких чеков, просто положил в карман.... Больше здесь не останавливаемся.
",geo,0
242589,"Прислали спагетти вместо бугатини, так паста очень хорошая",perekrestok,2
38279,"Хоть и доставка платная, всё равно 1.5 месяца в дороге.
Ткань просвечивает. Подойдет только для дома. 
До поднятия юаня такие вещи стоили 50 рублей, курс поднялся  в 2 раза, почему вещи подорожали в 3 раза? 
Кстати покупали за 170 р. плюс доставка 43 р.",rureviews,1
208593,"Безумно красивый фильм с прекрасной музыкой и очаровательным видом, столь далекой и незнакомой Исландии. Музыка Исландии развивалась отдельно от тенденций запада и востока, ей доставалось лишь лучшее с Америки и Европы. Принимая лишь самые интиресные и необычные моменты, музыкальная культура Исландии выроботала свой, неповторимый и не похожий ни на один мировой стиль музыки.

Фильм посвящен именно этой, немаловажной части Исландской жизни. В нем показаны концертные и репитиционные выступления молодых групп, популярных и не очень у себя на родине, но так незнакомых уху российского зрителя, интервью продюссеров, и конечно же отдельный рассказ о, заполучившей почитателей по всему свету, восхитительной Bjork.

На большом экране фильм был бесподобен!!",kinopoisk,0
98374,"Ожидал большего после 8ми месяцев ожидания. Манга была куда более эффектная. Оратор выше видимо ребенок. Самый легкий способ убить данный фендом - это продолжить его. Увы, Куробас уже высосан и его продолжение будет только во вред, взаимоотношения персонажей уже максимально построены. Один раз этот фильм посмотреть можно. Итог: 7/10",anime,0
22003,"Не подошёл размер, оказался маленьким. ",rureviews,0
89955,"В целом обчень добротый тайтл. стоит смотреть. Рисовка норм для 2007 года. ГГ отличный чувак, как всегда имба. Правда не очень таки ясны их отношения, вроде как родственные, а вродекак и романтика. Но для японии наверно это норма. Я не знаю, заканчивается ли на этом ранобе, или есть продолжение там, кто читал - черкните пожалуйста. Ставлю смело 8/10.",anime,0
68924,"Заказ ждали 4 месяца.так и не дождались,деньги вернули.продовец был всегда на связи.",rureviews,2
1322,"Товар отслеживался полностью до момента получения на почте. Качество понравилось, но размер не подошёл. Заказывала 75 С. К обхвату претензий нет , а чашечка оказалась сосем уж маленькой. Открыла спор. Вернули часть
 оплаченной суммы.",rureviews,0
65433,"не чего не отправил,просил спор закрыть,все решилось через али экспресс",rureviews,2
277655,Манка  хорошего качества,perekrestok,1
196695,"Хорош грустить Наташка!)
послушай песенку:D 
детка )))))",rusentiment,1
152801,"Замечательная автошкола!\nОтдельное спасибо Виктору Александровичу, все прекрасно объясняет\nСоздает приятную атмосферу на занятиях, благодаря чему каждый раз с радостью иду на вождение!\nСтарается подготовить ко всем ситуациям которые будут происходить в реальной жизни!\nИ заправляться научилась и даже знаю как и куда нужно заливать антифриз, тормозную жидкость и т.д.\nВсе делали постепенно, Виктор Александрович всегда спрашивал мою готовность приступить к новому этапу обучения.\nКаждое наше занятие сопровождается приятным общением!\nОчень часто теряю интерес к какому либо обучению, но тут ни разу не пропустила занятие, была рада туда идти даже к 8 утра!\nЖелаю чтобы у всех были такие хорошие инструкторы!!!!\n\n
",geo,1
234307,"У меня размер ближе к  s,  заказала m на всякий случай и он оказался мал! Торчат нитки",ru-reviews-classification,2
216570,"Возможно, кому-то данная рецензия покажется слишком резкой, но не могу сдерживать нахлынувших негативных эмоций.

Фильм – кошмар. Хотя, может, это я такая непросвещённая и далёкая от всего прекрасного не поняла его ГРАНДИОЗНОЙ задумки… Возможно, ничего не могу отрицать. 

Картина навевала скуку, несколько раз меня неумолимо клонило в сон, а пока я боролась с Морфеем, на экране мелькали девушки-секси в мега-коротеньких юбочках и с автоматами наперевес. Одна из них блондинка, страдающая галлюцинациями, по идее должна была отпадно танцевать, да так, что у зрителей, рты от восторга открываются. И я глупая ждала этого прекрасного танца почти два часа. И что? Не показали, видно режиссёр просто не мог держать камеру в руках от переполнившего его счастья.

Как итог – пустой, абсолютно глупый фильм, напичканный спецэффектами и красивыми актрисами. Мой вам совет – не тратьте на него время, а лучше посмотрите что-то действительно стоящее.",kinopoisk,2
255028,"Рис грязный. Много колотого. Брала для каши, но скорее всего буду варить собаке.",perekrestok,0
200236,"Не покупайте мясо в магазине ""Диета""!
 Уже два ужина мне испортили - один почти год назад и сегодня. Сегодня один кусок пах кислятиной, второй тухлятиной(((
 Хорошо что сосиски купил прозапас)))",rusentiment,2
245105,"Очень сухое, невусное мясо. Есть можно только сильно завлив каким-нибудь соусом",perekrestok,2
171879,"Вообще, мне всегда нравилось это кафе. Но сегодня нет предела возмущению. Заказали четыре супа. Три бульона и один тыквенный. Не знаю, куда смотрит повар и руководство, и главное, хотелось бы знать, сами бы они стали есть свои супы? Написано в меню , бульон из цыпленка. Но по факту , просто вода. Варят его из грудки, вкуса совсем не имеет, просто как обычный кипяток по вкусу. А 250 рублей маленькая плошечка. Добавки , в виде не вкусного мяса или яйца, ещё 150 рублей. Тыквенный суп-тоже не суп вовсе, не понятная жижа, по консистенции тоже как вода, вернули и даже не стали пробовать это. Вообще , такой едой людей кормить ну просто нельзя-помои самые натуральные. Разочарование, не вернемся больше никогда.
",geo,2
143793,"Сам парк шикарный. Проделана огромная работа. Всё с умом. \nНО!!!!! \nЧасть парк уже ремонтируется. Непонятно почему это нельзя было сделать весной. \nТуалеты вроде только после сан перерыва, но жуткая вонь, грязно. Внутри темно, крючки для сумок оторваны. \nВ фуд-корт очередт на улице. \nВода в автоматах стоит 120 р за бутылку. На улице +30...... \nВозле детской площадки есть автомат с мороженым. Но, наверное, пить после этого детям не хочется. \nВозле детской зоны ресторан Восход. Мне кажется, будь там что-то приемлое и на вынос, был бы больше спрос. \nВ подземном музее убрали археологическую Эскозицию. \nВ общем, в следующий раз как умные купим пирожки у церкви и наберём воды побольше.... Ну или пойдём в будни
",geo,0
96661,"На мой взгляд эта маньхуа лучше, чем аниме Guomin Laogong Dai HuijiaИдеальный муж и я, или Как украсть 55 поцелуев. Тем не менее, она не идеальна. Начало неплохое и даже довольно интересное. Нам довольно быстро объясняют причину брака и становится интересно наблюдать за развитием отношений главных героев. В отличие от аниме, в маньхуа не так много времени уделяется флешбэкам и они вписаны в сюжет очень уместно. Вдобавок, главы очень короткие (~10 страниц), поэтому читать очень легко. К сожалению, потом все становится слишком затянуто, сюжет практически не двигается. Персонажи очень сильно тормозят. Иногда в действиях персонажей совершенно нельзя найти логику и это начинает очень сильно раздражать.В целом, маньхуа не так плоха, поэтому если вы в настроении почитать романтику, то это вполне себе вариант.",anime,0
114440,"Это аниме спасут только арки об Саске, Оцоцуки или что нибудь поинтереснее этого. 1 арка ужасно бесполезная, да, она  раскрывает главных героев, но она ужасно скучная, хотя бой в конце был норм. А эта просто ""Саске вернись в деревню"" Только в 1 много нулей раз хуже. У меня еще есть надежды, судя по манге, но такое чувство они не оправдают себя. Зря они отказались от идеии Акацуки, лучше бы тогда их вообще не показывали.",anime,2
121605,"Первый сезон мне более-мение понравился, но под конец второго сезона сериал начал меня выбешивать. Нет шутки попадались хорошие, да и то что в одной серии Хидэёси все (ВСЕ) понимают что он парень, а в следующей они же говорят что он женщина вполне свойственен аниме которые в основном держутся на юморе. Все (да я не скажу почему он стал меня выбешивать, смеритесь 😤 )",anime,2
274271,"Достоинства:
Очень удобно и легко вводить
Недостатки:
Цена выше, чем за обычные
",perekrestok,1
32095,"кофта очень хорошая доставка супер быстрая швы ровные нитки не торчат 
ТОВАР СОВЕТУЮ",rureviews,1
2201,просвечиваются,rureviews,0
