ID,text,src,label
103329,"Субъективное мнение: Для компаний ""Lerche"", аниме слабовато, ожидал большего. Объективное:Аниме повествует о классовом разделений и что для достижения цели, необходимо прикладывать значительные усилия. Сюжет проработан хорошо. Имеет свою завязку, которой и старается заинтересовать - по ходу развивая идею. Не подойдёт тем, кто хочет активного экшена или же ярких моментов. События спокойные и размеренные.Персонажи: показаны разные типажи личности и довольно логическое развитие их историй.Рисовка: классическая рисовка от ""Lerche"", для тех кто смотрел их произведения раньше, всё будет понятно. Для новых зрителей, классическая рисовка на уровне.Основное направление и оценка: заинтересует любителей психологии человека в обществе. Если двигаться по жанру, то можно ставить спокойно 7-8/10. Для остальных же, аниме может показаться скучноватым, и будет не досмотрено до конца (5-6/10).Для более конкретного составления мнения, советую посмотреть 1-2 серий, этого будет достаточно, что бы понят - стоит ли смотреть дальше. Аниме идёт под одной стилизацией сюжета.",anime,1
189528,"Приложение не открывается по wi-fi, при том, что интернет стабилен, приложение открывается только через оператора",sber,0
23590,очень тонкая ткань.как марля.но может спать будет прохладно.потом напишу еще.когда опробую,rureviews,0
142585,"Первое и наверное последнее посещение данного заведения. Удивить смогли только названием. \n\nЛетняя площадка: очень простая,  глаз ни за что не цепляется, звёздочки только за наличие зонтиков от солнца и свежий воздух.\n\nМеню: скромное, непонятное (описание многих блюд не даёт ни какого представления о самих блюдах, просто перечисление ингредиентов. Винная карта больше Меню в 2 раза, наверное тут надо пить)))\n\nЦены: выше средних по городу.\n\nКухня: вкусового удовольствия не получил, все очень просто, и не совсем хорошо приготовлено(что то не дожарено, что то пережарено). Порции небольшие.\n\nСервис: официанты стараются, вежливы, но скорость подачи блюд не особо быстрая, при почти пустом заведении.\n\nВ общем рекомендовать не могу.
",geo,0
136543,"Не самый лучший аквапарк Крыма. Радует, что хлопки в бассейнах стало меньше. Это «+». \nИз «-»: Бесят:\n- мужчины, которые ходят в трусах, а не в купальных плавках;\n- спасатели, которым на все «пофиг» не смотрят, что дети прыгают с бортиков бассейна на головы купающихся;\n- работники кафе «Дельфин», которые считают, что лепешка с тремя кусочками курицы и четырьмя перышками салата - это пицца.\nНе подкачала только погода!
",geo,0
73017,"Продавец дал трек номер,когда начал отслеживаться в России оказалось что на имя и адрес другого покупателя, писала ему много раз об этом,отвечал какую то чушь в ответ, открыла спор, он тянул время, но в итоге согласился,в общем зря потраченное время! Не рекомендую заказывать у него товар!",rureviews,2
64545,"совершенно не соответствуют размерной сетке,оказались малы, продавец отказался вернуть деньги...",rureviews,2
214050,"Вилли. Мой самый любимый фильм детства. Как я мечтала, что как только у нас появится видеоплейер я сразу куплю кассеты и каждый день буду его смотреть, но эта мечта осталась несбыточной. Видик появился слишком поздно для 'Вилли'. 

Но, тем не менее, я не пропускаю каждый показ по телевизору и тогда и теперь. И в конце всегда плачу. Даже сейчас. Конечно, уже не так горько. Фильм очень чувственный. Дружба мальчика и огромного кита-касатки такая искренняя. В конце сердце сжимается от тоски...

10 из 10",kinopoisk,1
247466,"Вода хорошая, но крышки невозможно открыть. Какое-то издевательство.",perekrestok,2
161569,"Была на процедуре в первый раз, у мастера Елены Битюковой. Минусов нет, всё понравилось.\nПлюсы- уютная студия, быстро, безболезненно. Отзыв пишу спустя месяц-после первой процедуры отличный эффект. \nУдобное расположение студии.
",geo,1
121332,"Не знаю почему но мне кажется изначально сериал был подписан иначе?!  А именно с приставкой ""Ярость Бахамута"".. Вполне могу ошибаться но хзхз.. я уверен что видел... и в связи с этим как и многие думал что это  хоть как то связано с Бахамутом, а в итоге получил ЭТО, само собой пригорает... вообще не понимаю зачем ставить на одну полочку совершенно не связанное? удалите из списка связанных и у всех сразу вопросы пропадут.. (а я же и отвечу,это чтоб фанов Бахамута привлечь, вот только они горящих жоп скорей наберут чем аудиторию)По Аниме.. как по мне хреновенько даже для среднечка.. 6/10 при том что я ниже 5 не ставлю... 1. Не ждите тут полноценную историю.. это скорей пачка филлеров или реклама чего то предстоящего, тут нет воооообще ни чего.. просто пусто.. я в начале начал записывать кучу вопрос в заметки, что, почему, как, куда, кто, когда, зачем, откуда.... ну где то в середине тайла я понял что это дохлый номер.... 2. К моему недоумению в жанрах не нашел ""повседневность"".. моя пятая точка и так накалена от подставы с связанными тайлами так еще и жанр просрали.. все уныло и грустно.. на последних сериях не выдержал отматывал... 3. Из личных минусов могу выделить то что в каждой серии на 10ой (из 15) минуте начинаются титры а потом давят еще 5 минут аниме..т.е.  почти по середине что ж вы делаете то а.... ЗА ЧТОООО...4. Во всех этих 10 по 15 минутах есть лишь один плюс, один, огромный, милый, толстохвостый, скромный и застенчивый плюс все остальные просто картон...",anime,2
127555,"3звезды только за организацию погрузки, спросил по требованию заказчика увеличенное количество ттн сказали что их сделают при погрузкой. На погрузке сказали, что надо было заказывать заранее (на выписке]. И это в 4 часа утра. На погрузку встал в 12 дня. Загрузили в 4 утра. Стоял в очереди 3.
",geo,0
88559,"спойлерЭто аниме выдвигается неплохим толчком к совершенствованию и достижению своих целей. Хорошо показывает, как нельзя сдаваться и унывать, даже, когда ты проиграл, и конец предрешен, нужно вставать с колен и двигаться дальше, как бы сложно и препятственно ни было. Грустно было, что Карасуно не попало на национальные, но даже неплохо, потому что они новички и играют вместе не так давно, за исключением третьегодок, у них все еще впереди. Победа в конце стала бы сказкой, я рада, что показали  развязку более приземленно и реалистично.",anime,0
201508,"Живя прошлым, ты ломаешься.",rusentiment,2
210093,"Ну, японцы всегда снимают трогающие за душу сериалы и этот сериал не исключение.

Да конечно в жизни такого не бывает, девушку сразу можно понять, что это девушка, но это же дорама, а что здесь только не может быть. 

Начну с главной героини, которую сыграла  Маки Хорикита  надо же быть такой мужественной, чтобы пойти в мужскую школу из-за парня и преодолеть все трудности, она молодец! Добрый, милый сериал, здесь показано дружба и любовь присутствует. При просмотре сериала можно беззаботно смеяться, над их глупыми шутками. Есть немного яоя, что мне понравилось.

А конец... с улыбкой на лице плакала, а после просмотра остался теплый осадок.

10 из 10",kinopoisk,1
105765,"Небольшой любитель манги, у меня и сотни комплитов не наберется.Но тут меня захватило буквально с первых страниц и не смог оторваться, пока не дочитал до конца. Оригинальная рисовка, необычный сеттинг. Если вы любите Маленького принца Экзюпери, то и эта манга не оставит вас равнодушным. Ужасно недооценена и удивительно, насколько мало популярна.Однозначно рекомендую.",anime,1
126192,"+Номер чистый, аккуратный, ресепшн приветливый. Цена\n- нет халатов, не было горячей воды в номере, а телефона в номере нет!!! паркетные полы скрипят, из коридора слышло о чём спорят в номере. Стаканы в номере есть, а вода в кулере на этаже 😂
",geo,0
161073,"Отличное заведение! Очень всегда вкусно и приятная атмосфера. Приветливые Официанты, всегда подскажут с выбором. Очень нравится, как готовят быстро и вкусно!
",geo,1
270777,"не совсем традиционное: 
много сахара, слишком сдобный вкус. 
Первый раз купила и разочарована.",perekrestok,0
152838,"Прекрасное место! Очень стильное и приятное! Разные типы бань. Приятный хамам с ароматом эвкалипта. Попали на ежечасное парение опахалом в разных банях. Красивый бассейн и выиды. Приколы типа контрасных душей, зоны с греющим светом, маскжные части. Спасибо за чудесное место, много пространство. В Питере это единственное место прМ комплекс, где совмещен качество и стиль. Что-то хотябы похожеепо наполняемости на термы мира в Новосибирске) 
",geo,1
191055,"Заказал на сайте дебетовую мультикарту ВТБ мир, пришло сообщение, что карта готова и могу получить её в отделении на Пушкина 20, куда и пришел 04.01.2022. В итоге сотрудница сообщает, что карту надо ждать неделю, несмотря на смс сообщение о готовности, Мира вообще нет, только Виза и никакой 1000 р не будет. Для этого видите ле заявки онлайн недостаточно, нужно ещё через курьера её заказать именная должна быть и ждать неделю, о чем, к слову, на сайте информации не имеется. Несмотря на в целом корректное обслуживание, не понравилось психологическое давление на меня в процессе оформления. На акцию с 1000 р изначально особо не рассчитывал, но неприятно, что вот так грубо лишили данной возможности. Не вводите в заблуждение клиентов, не указывая нюансы получения нужной карты и указанного вознаграждения по покупке.",bank,0
268714,Плохо прилипает. Сложно снять лист,perekrestok,0
229664,"Группа советских саперов со щупами направляется на разминирование в центре разрушенного Сталинграда.Красноармеец вытаскивает раненого товарища с поля боя на подступах к Сталинграду.Рабочий сталинградского завода Красный октябрь с пулеметом ДТ-29Красноармейцы ведут бой среди разрушенных зданий Сталинграда.Немецкие солдаты пробираются через генераторный зал разрушенной электростанции в Сталинграде.Панцергренадеры 16-й танковой дивизии вермахта, вышедшие к берегу Волги под Сталинградом.Советский расчет 50-мм ротного миномета ведет огонь в Сталинграде.Жители Сталинграда готовят пищу у развалин своего дома, разрушенного немецкими бомбардировками.Две жительницы Сталинграда везут на велосипеде свои вещи, покидая город.Две жительницы Сталинграда везут свои пожитки на тачке, покидая разрушенный город.Советские солдаты защищают завод Красный Октябрь во время Сталинградской битвы.Разбитый немецкий истребитель Мессершмитт в Сталинграде, осень 1942 года. Мимо самолета проходят беженцы с вещами, покидающие город. В небе висят аэростаты заграждения.",linis,2
173147,"Обслуживание упало и пробило дно новый кассир отбивает желание посещать это заведение.\n#Р\nраньшебылолучше\n
",geo,2
40011,"Как всегда восторг!!! Это мои люби8мые
 летние штанишки!!!!Доставка самая быстрая!!!Спасибо продавцу!!!Всем девушкам с широкой талией и роскошными бедрами рекомендую!!! только на не высокий рост,а то будут как капри.",rureviews,1
247633,В этот раз привезли очень плохие на вкус.,perekrestok,2
109013,"Ожидал я , значит, фансервиного гаремника, но, к моему удивлению, получил отличную задумку (ну, плюс - минус). Из минусов: маловато раскрыли персонажей, я ожидал большего (хотя, всего 12 серий, а рофлов, конечно же, нужно заварить побольше!). В реализации ""Пять Невест"" сериал  явно проиграл ""Кагуе""...  (и, как Кагуя, этот тайтл потролил зрителей своей концовкой.Из плюсов: Последние серии про лагерь неплохо так вытащили (у меня чёт лютая ностальгия пошла, когда дело пошло по танцам и лагерному костру. Несмотря на то, что рофлов много, большинство из них, в принципе, сойдут... Ну и опенинг милый Учитывая мою нравственность завышать оценки практически любому тайтлу - на 8 потянет.",anime,1
246064,Непонятное желе,perekrestok,2
82741,"Товар так и не получила, открыла спор, вернули деньги!!! Очень жаль .",rureviews,2
252755,"Ужасный жесткий горох, испортил мне салат. Если нужны кому пульки побольше калибра, берите этот горох, им доску пробить можно. Кожица толстая, жесткая, мякоть невыразительная. Запомню, чтоб больше не покупать. К продавцу претензий нет - упаковка и сроки не нарушены.",perekrestok,2
167262,"Чудесное кафе как для посиделок с детьми, так и для свидания или встречи с друзьями. Готовят вкусно, порции большие. Есть детский уголок. Прекрасный интерьер, который можно все время рассматривать, очень уютно
",geo,1
175102,"Вначале о минусах:\n1)Называются грузинским рестораном , но при этом исрользуют продукты ,которых впринципе нет в грузинской кухне\n2)Повара имеют очень низкую квалификацию , что даже не могут приготовить качественно базовые блюда, например, вместо картофельного пюре принесли просто клейстер\n3)Грубое нарушение законодательсва РФ - автоматическое включение (  то есть без согласия потребителя) чаевых в счёт\n4)Отсутвие огнетушителей\nО плюсах\nБолее менее адыкватная работа персонала зала ( но есть пробелы в знании меню)
",geo,2
66932,"На короткое туловище рассчитано боди. Ходит дочка 10 лет в нем. По росту как раз, но по объёму в животе и в ногах ей мало. ",rureviews,2
263177,"Можно и 5 звёзд поставить из-за цены , а так очень жидкое вещество , расход большой",perekrestok,0
242564,"Кокос оказался гораздо меньше, чем я думала - в Тайланде совсем они не такие - они больше раза в два (видимо, другой сорт). Сока, соответственно, тоже не очень много. На вкус он нормальный.

Но главное, что неприятно - кокос не открылся по линии, как указано на упаковке (стукните по заранее намеченной линии) - стучали-стучали, ничего не произошло :(",perekrestok,2
11665,"Шортики узковаты мне в бедре, но у меня нашлась девочка, которой я их подарила.. Мне не подошёл размер",rureviews,0
102329,"Этот шедевр попался ко мне в руки от сестры на день рождения. За что ей огромное спасибо. .   В конце 1 первой серии стало интересно.  Главные герои, для меня олицетворяют-разные качества людей. Есть люди не сильные, но умные, как наш Арминчик. Есть люди умные и сильные,это красотка Микаса. И есть люди которые идут по своей цели и воли, это Эрен.  Что мне понравилось в этом аниме, так это гиганты, кровь и как они убивают гитанов. Надеюсь на 2 сезон и на море крови.",anime,1
183850,"Оценка думаю не самой больнице, а в целом всей нашей системе здравоохранения.... То что происходит здесь, это последствия не профессионального руководства сверху и убийственных реформ. Всем советую к назначениям относиться с большой осторожностью. Терапевт лечащий орви по бумажке это вообще что то страшное... \nЕсли ты говоришь врачу, что у тебя распирание в груди (больше похожее на трахеит) и нет кашля, а она слушает только лёгкие со спины, говорит, что там чисто и назначает АСС... А для лечения носа и ушей вообще ничего, хотя я сообщила о хронической гаймотрите и о том, что нос и уши просто замучили... Это что врач? Всех метлой обратно в институт!!!
",geo,2
57380,"нормальный бюст. качество неплохое. единственное лично мне оказались великоваты на спине резинки, горбятся, придется чуть ушивать.
вкладыши сразу вытащила за ненадобностью, итак нормально держит, если грудь небольшая.",rureviews,1
